,movie_id,movie_name,year,genre,,director,cast
0,tt15354916,Jawan,2023,"Action, Thriller",,Atlee,"Shah Rukh Khan, Nayanthara, Vijay Sethupathi, Deepika Padukone"
1,tt15748830,Jaane Jaan,2023,"Crime, Drama, Mystery",,Sujoy Ghosh,"Kareena Kapoor, Jaideep Ahlawat, Vijay Varma, Saurabh Sachdeva"
2,tt11663228,Jailer,2023,"Action, Comedy, Crime",,Nelson Dilipkumar,"Rajinikanth, Mohanlal, Shivarajkumar, Jackie Shroff"
3,tt14993250,Rocky Aur Rani Kii Prem Kahaani,2023,"Comedy, Drama, Family",,Karan Johar,"Ranveer Singh, Alia Bhatt, Dharmendra, Shabana Azmi"
4,tt15732324,OMG 2,2023,"Comedy, Drama",,Amit Rai,"Pankaj Tripathi, Akshay Kumar, Yami Gautam, Pawan Malhotra"
5,tt18266472,Sukhee,2023,Drama,,Sonal Joshi,"Shilpa Shetty Kundra, Amit Sadh, Chaitannya Choudhry, Kusha Kapila"
6,tt18561736,The Great Indian Family,2023,Family,,Vijay Krishna Acharya,"Alka Amin, Bhuvan Arora, Manushi Chhillar, Srishti Dixit"
7,tt3691740,The BFG,2016,"Adventure, Family, Fantasy",,Steven Spielberg,"Mark Rylance, Ruby Barnhill, Penelope Wilton, Jemaine Clement"
8,tt12844910,Pathaan,2023,"Action, Adventure, Thriller",,Siddharth Anand,"Shah Rukh Khan, Deepika Padukone, John Abraham, Dimple Kapadia"
9,tt15464390,Mastaney,2023,"Action, Drama, History",,Sharan Art,"Tarsem Jassar, Simi Chahal, Gurpreet Ghuggi, Karamjit Anmol"
10,tt1187043,3 Idiots,2009,"Comedy, Drama",,Rajkumar Hirani,"Aamir Khan, Madhavan, Mona Singh, Sharman Joshi"
11,tt14914988,Satyaprem Ki Katha,2023,"Comedy, Drama, Musical",,Sameer Vidwans,"Kartik Aaryan, Kiara Advani, Supriya Pathak, Gajraj Rao"
12,tt3741834,Lion,2016,"Biography, Drama",,Garth Davis,"Dev Patel, Nicole Kidman, Rooney Mara, Sunny Pawar"
13,tt13131610,Bholaa Shankar,2023,"Action, Drama",,Meher Ramesh,"Chiranjeevi, Tamannaah Bhatia, Keerthy Suresh, Raghu Babu"
14,tt22188452,Haddi,2023,"Crime, Drama",,Akshat Ajay Sharma,"Nawazuddin Siddiqui, Anurag Kashyap, Mohd. Zeeshan Ayyub, Resh Lamba"
15,tt28568397,Friday Night Plan,2023,"Comedy, Drama",,Vatsal Neelakantan,"Babil Khan, Amrith Jayan, Medha Rana, Aadhya Anand"
16,tt21908676,Neeyat,2023,"Crime, Mystery, Thriller",,Anu Menon,"Vidya Balan, Ram Kapoor, Rahul Bose, Neeraj Kabi"
17,tt15441054,Gadar 2,2023,"Action, Adventure, Drama",,Anil Sharma,"Sunny Deol, Amrish Puri, Nana Patekar, Ameesha Patel"
18,tt27542289,Por Thozhil,2023,"Action, Crime, Thriller",,"Vignesh Raja, T. Senthil Paramasivam","R. Sarathkumar, Ashok Selvan, Nikhila Vimal, Sarath Babu"
19,tt0454876,Life of Pi,2012,"Adventure, Drama, Fantasy",,Ang Lee,"Suraj Sharma, Irrfan Khan, Adil Hussain, Tabu"
20,tt0249371,Asoka,2001,"Action, Biography, Drama",,Santosh Sivan,"Shah Rukh Khan, Kareena Kapoor, Danny Denzongpa, Hrishitaa Bhatt"
21,tt0838221,The Darjeeling Limited,2007,"Adventure, Comedy, Drama",,Wes Anderson,"Owen Wilson, Adrien Brody, Jason Schwartzman, Amara Karan"
22,tt5074352,Dangal,2016,"Action, Biography, Drama",,Nitesh Tiwari,"Aamir Khan, Sakshi Tanwar, Fatima Sana Shaikh, Sanya Malhotra"
23,tt8239946,Tumbbad,2018,"Drama, Fantasy, Horror",,"Rahi Anil Barve, Anand Gandhi, Adesh Prasad","Sohum Shah, Jyoti Malshe, Anita Date-Kelkar, Ronjini Chakraborty"
24,tt15428134,Dunki,2023,"Comedy, Drama",,Rajkumar Hirani,"Shah Rukh Khan, Taapsee Pannu, Boman Irani, Vicky Kaushal"
25,tt24485052,Sirf Ek Bandaa Kaafi Hai,2023,"Crime, Drama, Thriller",,Apoorv Singh Karki,"Manoj Bajpayee, Surya Mohan Kulshreshtha, Jai Hind Kumar, Nikhil Pandey"
26,tt1954470,Gangs of Wasseypur,2012,"Action, Comedy, Crime",,Anurag Kashyap,"Manoj Bajpayee, Nawazuddin Siddiqui, Tigmanshu Dhulia, Richa Chadha"
27,tt15433600,Khufiya,2023,"Action, Biography, Crime",,Vishal Bhardwaj,"Tabu, Ali Fazal, Wamiqa Gabbi, Azmeri Haque Badhon"
28,tt13751694,Animal,2023,"Action, Crime, Drama",,Sandeep Reddy Vanga,"Ranbir Kapoor, Triptii Dimri, Saurabh Sachdeva, Anil Kapoor"
29,tt15891388,Miss Shetty Mr Polishetty,2023,"Comedy, Drama, Romance",,Mahesh Babu P.,"Keshav Deepak, Abhinav Gomatam, Jayasudha, Koushik Mahata"
30,tt19755170,Bawaal,2023,"Action, Drama, Romance",,Nitesh Tiwari,"Varun Dhawan, Janhvi Kapoor, Manoj Pahwa, Anjuman Saxena"
31,tt6277462,Brahmastra Part One: Shiva,2022,"Action, Adventure, Fantasy",,Ayan Mukerji,"Amitabh Bachchan, Ranbir Kapoor, Alia Bhatt, Nagarjuna Akkineni"
32,tt20913276,Ghoomer,2023,"Drama, Sport",,R. Balki,"Amitabh Bachchan, Shabana Azmi, Abhishek Bachchan, Saiyami Kher"
33,tt18411490,Tiger 3,2023,"Action, Adventure, Thriller",,Maneesh Sharma,"Salman Khan, Katrina Kaif"
34,tt8672856,Tu Jhoothi Main Makkaar,2023,"Comedy, Romance",,Luv Ranjan,"Ranbir Kapoor, Shraddha Kapoor, Krrish Saini, Anubhav Singh Bassi"
35,tt15501640,Drishyam 2,2022,"Crime, Drama, Mystery",,Abhishek Pathak,"Ajay Devgn, Akshaye Khanna, Tabu, Shriya Saran"
36,tt0083987,Gandhi,1982,"Biography, Drama, History",,Richard Attenborough,"Ben Kingsley, John Gielgud, Rohini Hattangadi, Roshan Seth"
37,tt2338151,PK,2014,"Comedy, Drama, Sci-Fi",,Rajkumar Hirani,"Aamir Khan, Anushka Sharma, Sanjay Dutt, Boman Irani"
38,tt1188996,My Name Is Khan,2010,"Adventure, Drama, Romance",,Karan Johar,"Shah Rukh Khan, Kajol, Sheetal Menon, Katie Amanda Keane"
39,tt3405236,Raees,2017,"Action, Crime, Drama",,Rahul Dholakia,"Shah Rukh Khan, Jaideep Ahlawat, Sunny Leone, Nawazuddin Siddiqui"
40,tt26324936,Rama Banam,2023,"Action, Drama",,Sriwass,"Gopichand, Dimple Hayathi, Jagapathi Babu, Kushboo"
41,tt8108198,Andhadhun,2018,"Crime, Mystery, Thriller",,Sriram Raghavan,"Tabu, Ayushmann Khurrana, Radhika Apte, Anil Dhawan"
42,tt23036080,Thank You for Coming,2023,Comedy,,Karan Boolani,"Bhumi Pednekar, Dolly Ahluwalia, Shibani Bedi, Saloni Daini"
43,tt22086334,Dream Girl 2,2023,"Comedy, Drama, Romance",,Raaj Shaandilyaa,"Paresh Rawal, Ananya Panday, Ayushmann Khurrana, Annu Kapoor"
44,tt15380630,Kushi,2023,"Comedy, Drama, Romance",,Shiva Nirvana,"Samantha Ruth Prabhu, Vijay Deverakonda, Lakshmi, Murli Sharma"
45,tt0986264,Taare Zameen Par,2007,"Drama, Family",,"Aamir Khan, Amole Gupte","Darsheel Safary, Aamir Khan, Tanay Chheda, Sachet Engineer"
46,tt4430212,Drishyam,2015,"Crime, Drama, Mystery",,Nishikant Kamat,"Ajay Devgn, Shriya Saran, Tabu, Rajat Kapoor"
47,tt22297828,Chor Nikal Ke Bhaga,2023,"Crime, Drama, Thriller",,Ajay Singh,"Yami Gautam, Sunny Kaushal, Sharad Kelkar, Indraneil Sengupta"
48,tt10083340,Gangubai Kathiawadi,2022,"Biography, Crime, Drama",,Sanjay Leela Bhansali,"Alia Bhatt, Shantanu Maheshwari, Vijay Raaz, Indira Tiwari"
49,tt27012110,Gaslight,2023,"Crime, Horror, Mystery",,Pavan Kirpalani,"Sara Ali Khan, Vikrant Massey, Chitrangda Singh, Rahul Dev"
50,tt15245240,The Buckingham Murders,2023,Thriller,,Hansal Mehta,"Kareena Kapoor, Keith Allen, Haqi Ali, Chris Wilson"
51,tt13818368,Fighter,2024,"Action, Adventure, Thriller",,Siddharth Anand,"Hrithik Roshan, Deepika Padukone, Anil Kapoor, Akarsh Alagh"
52,tt15302222,Bholaa,2023,"Action, Adventure, Crime",,Ajay Devgn,"Ajay Devgn, Tabu, Abhishek Bachchan, Amala Paul"
53,tt1024943,Om Shanti Om,2007,"Action, Comedy, Drama",,Farah Khan,"Shah Rukh Khan, Deepika Padukone, Arjun Rampal, Kirron Kher"
54,tt0248126,Kabhi Khushi Kabhie Gham...,2001,"Drama, Musical, Romance",,Karan Johar,"Shah Rukh Khan, Kajol, Amitabh Bachchan, Hrithik Roshan"
55,tt24268454,The Kerala Story,2023,Drama,,"Sudipto Sen, Vipul Amrutlal Shah","Adah Sharma, Yogita Bihani, Sonia Balani, Siddhi Idnani"
56,tt13131350,Vikram Vedha,2022,"Action, Crime, Drama",,"Gayatri, Pushkar","Saif Ali Khan, Hrithik Roshan, Radhika Apte, Rohit Saraf"
57,tt0367110,"Swades: We, the People",2004,"Drama, Musical",,Ashutosh Gowariker,"Shah Rukh Khan, Gayatri Joshi, Kishori Ballal, Smith Seth"
58,tt3863552,Bajrangi Bhaijaan,2015,"Action, Adventure, Comedy",,"Kabir Khan, Mehmet Tutkun","Salman Khan, Harshaali Malhotra, Nawazuddin Siddiqui, Kareena Kapoor"
59,tt27501039,Bloody Daddy,2023,"Action, Crime, Drama",,Ali Abbas Zafar,"Shahid Kapoor, Vivan Bhatena, Diana Penty, Ronit Roy"
60,tt2980648,The Hundred-Foot Journey,2014,"Comedy, Drama",,Lasse Hallström,"Helen Mirren, Om Puri, Manish Dayal, Charlotte Le Bon"
61,tt10811166,The Kashmir Files,2022,Drama,,Vivek Agnihotri,"Mithun Chakraborty, Anupam Kher, Darshan Kumaar, Pallavi Joshi"
62,tt22892546,Akelli,2023,"Drama, Thriller",,Pranay Meshram,"Nushrratt Bharuccha, Amir Boutrous, Nishant Dahiya, Vijay Kumar Dogra"
63,tt2283748,OMG: Oh My God!,2012,"Comedy, Drama, Fantasy",,Umesh Shukla,"Paresh Rawal, Akshay Kumar, Mithun Chakraborty, Mahesh Manjrekar"
64,tt12915716,Adipurush,2023,"Action, Adventure, Drama",,Om Raut,"Kriti Sanon, Saif Ali Khan, Prabhas, Devdutta Nage"
65,tt15073166,IB 71,2023,"Action, Thriller",,"Sankalp Reddy, Lee Whittaker","Anupam Kher, Vidyut Jammwal, Dalip Tahil, Nissar Khan"
66,tt5935704,Padmaavat,2018,"Drama, History, Romance",,Sanjay Leela Bhansali,"Deepika Padukone, Ranveer Singh, Shahid Kapoor, Aditi Rao Hydari"
67,tt1562872,Zindagi Na Milegi Dobara,2011,"Comedy, Drama, Musical",,Zoya Akhtar,"Hrithik Roshan, Farhan Akhtar, Abhay Deol, Katrina Kaif"
68,tt2176013,Jab Tak Hai Jaan,2012,"Drama, Romance",,Yash Chopra,"Shah Rukh Khan, Katrina Kaif, Anushka Sharma, Lucy Phelps"
69,tt15128068,Monica O My Darling,2022,"Comedy, Crime, Drama",,Vasan Bala,"Rajkummar Rao, Huma Qureshi, Sikandar Kher, Bagavathi Perumal"
70,tt14099334,Bhediya,2022,"Comedy, Fantasy, Horror",,Amar Kaushik,"Varun Dhawan, Kriti Sanon, Abhishek Banerjee, Deepak Dobriyal"
71,tt1562871,Ra.One,2011,"Action, Adventure, Sci-Fi",,Anubhav Sinha,"Shah Rukh Khan, Arjun Rampal, Kareena Kapoor, Shahana Goswami"
72,tt10028196,Laal Singh Chaddha,2022,"Comedy, Drama, Romance",,Advait Chandan,"Aamir Khan, Ahmad Ibn Umar, Kareena Kapoor, Hafsa Ashraf"
73,tt1285241,Don 2,2011,"Action, Crime, Thriller",,Farhan Akhtar,"Shah Rukh Khan, Florian Lukas, Om Puri, Priyanka Chopra Jonas"
74,tt15654262,Chup,2022,"Crime, Drama, Mystery",,R. Balki,"Dulquer Salmaan, Shreya Dhanwanthary, Sunny Deol, Pooja Bhatt"
75,tt0172684,Kuch Kuch Hota Hai,1998,"Comedy, Drama, Musical",,Karan Johar,"Shah Rukh Khan, Kajol, Rani Mukerji, Sana Saeed"
76,tt0461936,Don,2006,"Action, Crime, Thriller",,Farhan Akhtar,"Shah Rukh Khan, Priyanka Chopra Jonas, Arjun Rampal, Isha Koppikar"
77,tt0238936,Devdas,2002,"Drama, Musical, Romance",,Sanjay Leela Bhansali,"Shah Rukh Khan, Aishwarya Rai Bachchan, Madhuri Dixit, Jackie Shroff"
78,tt8130968,Badla,2019,"Crime, Drama, Mystery",,Sujoy Ghosh,"Amitabh Bachchan, Taapsee Pannu, Amrita Singh, Antonio Aakeel"
79,tt11905536,Gumraah,2023,"Action, Crime, Drama",,Vardhan Ketkar,"Aditya Roy Kapoor, Mrunal Thakur, Ronit Roy, Vedika Pinto"
80,tt2350496,The Lunchbox,2013,"Drama, Romance",,Ritesh Batra,"Irrfan Khan, Nimrat Kaur, Nawazuddin Siddiqui, Lillete Dubey"
81,tt15576460,Zara Hatke Zara Bachke,2023,"Comedy, Drama, Family",,Laxman Utekar,"Vicky Kaushal, Sara Ali Khan, Inaamulhaq, Sushmita Mukherjee"
82,tt0891592,Street Fighter: The Legend of Chun-Li,2009,"Action, Crime, Fantasy",,Andrzej Bartkowiak,"Kristin Kreuk, Neal McDonough, Michael Clarke Duncan, Chris Klein"
83,tt13334578,Ganapath,2023,"Action, Drama, Sci-Fi",,Vikas Bahl,"Tiger Shroff, Himanshu Jaykar, Kriti Sanon, Amitabh Bachchan"
84,tt12735488,Kalki 2898-AD,2024,"Action, Drama, Fantasy",,Nag Ashwin,"Deepika Padukone, Amitabh Bachchan, Dulquer Salmaan, Disha Patani"
85,tt0347304,Kal Ho Naa Ho,2003,"Comedy, Drama, Musical",,Nikkhil Advani,"Preity G Zinta, Shah Rukh Khan, Saif Ali Khan, Jaya Bachchan"
86,tt0361411,Bride & Prejudice,2004,"Comedy, Drama, Musical",,Gurinder Chadha,"Martin Henderson, Aishwarya Rai Bachchan, Nadira Babbar, Anupam Kher"
87,tt6571548,The White Tiger,2021,"Crime, Drama",,Ramin Bahrani,"Adarsh Gourav, Rajkummar Rao, Priyanka Chopra Jonas, Vedant Sinha"
88,tt27989067,Lust Stories 2,2023,"Drama, Romance",,"R. Balki, Sujoy Ghosh, Amit Ravindernath Sharma, Konkona Sen Sharma","Tamannaah Bhatia, Vijay Varma, Neena Gupta, Mrunal Thakur"
89,tt3735246,Bajirao Mastani,2015,"Action, Drama, History",,Sanjay Leela Bhansali,"Ranveer Singh, Deepika Padukone, Priyanka Chopra Jonas, Tanvi Azmi"
90,tt0195002,Kaun?,1999,"Mystery, Thriller",,Ram Gopal Varma,"Urmila Matondkar, Manoj Bajpayee, Sushant Singh"
91,tt5946128,Dear Zindagi,2016,"Drama, Romance",,Gauri Shinde,"Alia Bhatt, Shah Rukh Khan, Kunal Kapoor, Priyanka Moodley"
92,tt9052870,Chhichhore,2019,"Comedy, Drama, Romance",,Nitesh Tiwari,"Sushant Singh Rajput, Shraddha Kapoor, Varun Sharma, Prateik Patil Babbar"
93,tt15145764,Freddy,2022,"Drama, Mystery, Romance",,Shashanka Ghosh,"Kartik Aaryan, Alaya F, Karan Pandit, Sajjad Delafrooz"
94,tt2178470,Yeh Jawaani Hai Deewani,2013,"Comedy, Drama, Musical",,Ayan Mukerji,"Ranbir Kapoor, Deepika Padukone, Aditya Roy Kapoor, Kalki Koechlin"
95,tt7142506,Sir,2018,"Drama, Romance",,Rohena Gera,"Tillotama Shome, Vivek Gomber, Geetanjali Kulkarni, Rahul Vohra"
96,tt14295590,Mrs. Chatterjee vs. Norway,2023,"Biography, Drama",,Ashima Chibber,"Rani Mukerji, Jim Sarbh, Bodhisattwa Majumdar, Saswati Guhathakurta"
97,tt0374887,Munna Bhai M.B.B.S.,2003,"Comedy, Drama",,Rajkumar Hirani,"Sanjay Dutt, Arshad Warsi, Gracy Singh, Boman Irani"
98,tt3495026,Fan,2016,"Action, Drama, Thriller",,Maneesh Sharma,"Shah Rukh Khan, Shriya Pilgaonkar, Sayani Gupta, Waluscha D'Souza"
99,tt28540171,Welcome to the Jungle,2024, ,,Ahmed Khan,"Akshay Kumar, Sanjay Dutt, Disha Patani, Jacqueline Fernandez"
100,tt6148156,Vikram Vedha,2017,"Action, Crime, Drama",,"Gayatri, Pushkar, Gowtham Selvaraj","Madhavan, Vijay Sethupathi, Shraddha Srinath, Kathir"
101,tt0169102,Lagaan: Once Upon a Time in India,2001,"Drama, Musical, Sport",,Ashutosh Gowariker,"Aamir Khan, Raghubir Yadav, Gracy Singh, Rachel Shelley"
102,tt28282716,Trial Period,2023,"Comedy, Drama",,Aleya Sen,"Genelia Deshmukh, Manav Kaul, Shakti Kapoor, Sheeba Chaddha"
103,tt18413766,Kathal: A Jackfruit Mystery,2023,"Comedy, Crime, Drama",,Yashowardhan Mishra,"Sanya Malhotra, Joshi Anantvijay, Vijay Raaz, Rajpal Naurang Yadav"
104,tt10280296,Sardar Udham,2021,"Biography, Crime, Drama",,Shoojit Sircar,"Vicky Kaushal, Shaun Scott, Stephen Hogan, Amol Parashar"
105,tt3679040,Kisi Ka Bhai Kisi Ki Jaan,2023,"Action, Comedy, Drama",,Farhad Samji,"Salman Khan, Pooja Hegde, Venkatesh Daggubati, Jagapathi Babu"
106,tt15134398,King of Kotha,2023,"Action, Drama, Thriller",,Abhilash Joshiy,"Dulquer Salmaan, Aishwarya Lekshmi, Soubin Shahir, Ritika Singh"
107,tt2016894,Ek Tha Tiger,2012,"Action, Adventure, Romance",,"Mathur Goswami, Kabir Khan","Salman Khan, Katrina Kaif, Girish Karnad, Roshan Seth"
108,tt13130760,HIT: The First Case,2022,"Action, Crime, Drama",,Sailesh Kolanu,"Rajkummar Rao, Sanya Malhotra, Akhil Iyer, Jatin Goswami"
109,tt11976134,Singham Again,2024,Drama,,Rohit Shetty,"Kareena Kapoor, Deepika Padukone, Akshay Kumar, Ranveer Singh"
110,tt2555736,The Second Best Exotic Marigold Hotel,2015,"Comedy, Drama, Romance",,John Madden,"Judi Dench, Maggie Smith, Bill Nighy, Dev Patel"
111,tt0112870,Dilwale Dulhania Le Jayenge,1995,"Drama, Romance",,Aditya Chopra,"Shah Rukh Khan, Kajol, Amrish Puri, Farida Jalal"
112,tt28259207,Kill,2023,"Action, Adventure, Drama",,Nikhil Nagesh Bhat,"Lakshya, Raghav Juyal, Tanya Maniktala, Abhishek Chauhan"
113,tt7700730,October,2018,"Drama, Romance",,"Shoojit Sircar, Kuran Dhillon","Varun Dhawan, Banita Sandhu, Gitanjali Rao, Sahil Vedoliyaa"
114,tt15600222,An Action Hero,2022,"Action, Comedy, Crime",,Anirudh Iyer,"Ayushmann Khurrana, Jaideep Ahlawat, Neeraj Madhav, Gautam Joglekar"
115,tt23554840,The Vaccine War,2023,"Drama, Thriller",,Vivek Agnihotri,"Nivedita Bhattacharya, Anupam Kher, Girija Oak, Nana Patekar"
116,tt1093370,Jab We Met,2007,"Comedy, Drama, Romance",,Imtiaz Ali,"Shahid Kapoor, Kareena Kapoor, Tarun Arora, Dara Singh Randhawa"
117,tt7838252,K.G.F: Chapter 1,2018,"Action, Crime, Drama",,Prashanth Neel,"Yash, Srinidhi Shetty, Ramachandra Raju, Archana Jois"
118,tt10895576,Mimi,2021,"Comedy, Drama",,"Rajesh Bhatia, Laxman Utekar","Kriti Sanon, Evelyn Edwards, Pankaj Tripathi, Sai Tamhankar"
119,tt15832148,Afwaah,2023,"Drama, Thriller",,Sudhir Mishra,"Nawazuddin Siddiqui, T.J. Bhanu, Bhumi Pednekar, Eisha Chopra"
120,tt13130308,Godfather,2022,"Action, Crime, Drama",,Mohan Raja,"Chiranjeevi, Salman Khan, Nayanthara, Satyadev Kancharana"
121,tt8011276,Laila Majnu,2018,"Drama, Romance",,Sajid Ali,"Avinash Tiwary, Triptii Dimri, Sumit Kaul, Abrar Qazi"
122,tt1166100,Ghajini,2008,"Action, Drama, Mystery",,A.R. Murugadoss,"Aamir Khan, Asin Thottumkal, Jiah Khan, Aamir Naik"
123,tt5997666,Jab Harry Met Sejal,2017,"Comedy, Drama, Romance",,Imtiaz Ali,"Shah Rukh Khan, Anushka Sharma, Björn Freiberg, Bruce Huther"
124,tt2082197,Barfi!,2012,"Comedy, Drama, Romance",,Anurag Basu,"Ranbir Kapoor, Priyanka Chopra Jonas, Ileana D'Cruz, Saurabh Shukla"
125,tt1266583,Mumbai Meri Jaan,2008,Drama,,Nishikant Kamat,"Paresh Rawal, Kay Kay Menon, Irrfan Khan, Madhavan"
126,tt7212754,Ludo,2020,"Action, Comedy, Crime",,Anurag Basu,"Pankaj Tripathi, Abhishek Bachchan, Rajkummar Rao, Fatima Sana Shaikh"
127,tt3390572,Haider,2014,"Action, Crime, Drama",,Vishal Bhardwaj,"Shahid Kapoor, Tabu, Shraddha Kapoor, Kay Kay Menon"
128,tt13131232,Mission Majnu,2023,"Action, Drama, History",,Shantanu Bagchi,"Sidharth Malhotra, Rashmika Mandanna, Parmeet Sethi, Zakir Hussain"
129,tt1787988,Talaash,2012,"Crime, Drama, Mystery",,"Reema Kagti, Priyamvada Narayanan","Aamir Khan, Kareena Kapoor, Rani Mukerji, Nawazuddin Siddiqui"
130,tt4559006,Ae Dil Hai Mushkil,2016,"Drama, Music, Musical",,Karan Johar,"Ranbir Kapoor, Aishwarya Rai Bachchan, Anushka Sharma, Fawad Khan"
131,tt1280558,A Wednesday,2008,"Action, Crime, Drama",,Neeraj Pandey,"Anupam Kher, Naseeruddin Shah, Veerendra Saxena, Mahesh Kanual"
132,tt5638474,Wajah Tum Ho,2016,"Drama, Mystery, Romance",,Vishal Pandya,"Sharman Joshi, Sana Khan, Gurmeet Choudhary, Rajneesh Duggal"
133,tt7098658,Raazi,2018,"Action, Drama, Thriller",,Meghna Gulzar,"Alia Bhatt, Vicky Kaushal, Rajit Kapoor, Shishir Sharma"
134,tt0292490,Dil Chahta Hai,2001,"Comedy, Drama, Romance",,Farhan Akhtar,"Aamir Khan, Saif Ali Khan, Akshaye Khanna, Preity G Zinta"
135,tt13781794,Bye2,2020,"Drama, Romance",,Tanveer Hashmi,"Bhushan, Karan, Vipin Singh, Shreya Tyagi"
136,tt14152140,Darlings,2022,"Comedy, Drama, Thriller",,Jasmeet K Reen,"Alia Bhatt, Shefali Shah, Vijay Varma, Roshan Mathew"
137,tt11460992,Runway 34,2022,"Drama, Thriller",,Ajay Devgn,"Ajay Devgn, Amitabh Bachchan, Rakul Preet Singh, CarryMinati"
138,tt4635372,Masaan,2015,Drama,,Neeraj Ghaywan,"Richa Chadha, Sanjay Mishra, Vicky Kaushal, Pankaj Tripathi"
139,tt6452574,Sanju,2018,"Biography, Comedy, Drama",,Rajkumar Hirani,"Ranbir Kapoor, Paresh Rawal, Manisha Koirala, Vicky Kaushal"
140,tt16077702,Govinda Naam Mera,2022,"Comedy, Crime, Drama",,Shashank Khaitan,"Vicky Kaushal, Kiara Advani, Bhumi Pednekar, Renuka Shahane"
141,tt1839596,Rockstar,2011,"Drama, Music, Romance",,Imtiaz Ali,"Ranbir Kapoor, Nargis Fakhri, Shammi Kapoor, Kumud Mishra"
142,tt5690142,Mom,2017,"Crime, Drama, Thriller",,Ravi Udyawar,"Sridevi, Sajal Ali, Akshaye Khanna, Adnan Siddiqui"
143,tt6988116,Kalank,2019,"Drama, Romance",,Abhishek Varman,"Alia Bhatt, Kiara Advani, Sanjay Dutt, Kriti Sanon"
144,tt10324144,Article 15,2019,"Crime, Drama, Mystery",,Anubhav Sinha,"Ayushmann Khurrana, Nassar, Manoj Pahwa, Kumud Mishra"
145,tt8439854,Lust Stories,2018,"Drama, Romance",,"Zoya Akhtar, Dibakar Banerjee, Karan Johar, Anurag Kashyap","Kiara Advani, Vicky Kaushal, Bhumi Pednekar, Neil Bhoopalam"
146,tt13130948,Shehzada,2023,"Action, Comedy, Drama",,Rohit Dhawan,"Kartik Aaryan, Kriti Sanon, Paresh Rawal, Manisha Koirala"
147,tt6527426,Zero,2018,"Comedy, Drama, Romance",,Aanand L. Rai,"Shah Rukh Khan, Anushka Sharma, Katrina Kaif, Mohd. Zeeshan Ayyub"
148,tt13028258,A Thursday,2022,"Drama, Thriller",,Behzad Khambata,"Yami Gautam, Atul Kulkarni, Neha Dhupia, Dimple Kapadia"
149,tt0405508,Rang De Basanti,2006,"Comedy, Crime, Drama",,Rakeysh Omprakash Mehra,"Aamir Khan, Soha Ali Khan, Siddharth, Sharman Joshi"
150,tt9263550,Rocketry: The Nambi Effect,2022,"Biography, Drama",,Madhavan,"Madhavan, Simran, Rajit Kapoor, Ravi Raghavendra"
151,tt4535650,Dilwale,2015,"Action, Comedy, Drama",,Rohit Shetty,"Shah Rukh Khan, Kajol, Varun Dhawan, Kriti Sanon"
152,tt13449624,Jug Jugg Jeeyo,2022,"Comedy, Drama, Family",,Raj Mehta,"Varun Dhawan, Anil Kapoor, Kiara Advani, Neetu Singh"
153,tt2395469,Gully Boy,2019,"Drama, Music, Romance",,Zoya Akhtar,"Ranveer Singh, Alia Bhatt, Siddhant Chaturvedi, Vijay Raaz"
154,tt2112124,Chennai Express,2013,"Action, Comedy, Drama",,Rohit Shetty,"Deepika Padukone, Shah Rukh Khan, Sathyaraj, Nikitin Dheer"
155,tt7430722,War,2019,"Action, Adventure, Thriller",,Siddharth Anand,"Hrithik Roshan, Tiger Shroff, Vaani Kapoor, Ashutosh Rana"
156,tt10295212,Shershaah,2021,"Action, Biography, Drama",,Vishnuvardhan,"Sidharth Malhotra, Kiara Advani, Shiv Panditt, Pranay Pachauri"
157,tt7255568,Student of the Year 2,2019,"Action, Comedy, Drama",,Punit Malhotra,"Tiger Shroff, Ananya Panday, Tara Sutaria, Aditya Seal"
158,tt14428598,Qala,2022,"Drama, Music",,Anvita Dutt,"Triptii Dimri, Babil Khan, Swastika Mukherjee, Amit Sial"
159,tt4934950,Talvar,2015,"Crime, Drama, Mystery",,Meghna Gulzar,"Irrfan Khan, Konkona Sen Sharma, Neeraj Kabi, Sohum Shah"
160,tt15281704,Kuttey,2023,"Action, Comedy, Crime",,Aasmaan Bhardwaj,"Tabu, Arjun Kapoor, Naseeruddin Shah, Konkona Sen Sharma"
161,tt26445483,Fukrey 3,2023,"Comedy, Crime, Drama",,Mrighdeep Lamba,"Pankaj Tripathi, Farhan Akhtar, Richa Chadha, Pulkit Samrat"
162,tt12856788,Dangerous,2022,"Action, Crime, Drama",,Ram Gopal Varma,"Naina Ganguly, Rajpal Naurang Yadav, Mithun Purandare, Apsara Rani"
163,tt2905838,Bang Bang,2014,"Action, Adventure, Comedy",,Siddharth Anand,"Hrithik Roshan, Katrina Kaif, Pawan Malhotra, Danny Denzongpa"
164,tt0222012,Hey Ram,2000,"Crime, Drama, History",,Kamal Haasan,"Kamal Haasan, Shah Rukh Khan, Rani Mukerji, Hema Malini"
165,tt7518786,83,2021,"Biography, Drama, History",,Kabir Khan,"Ranveer Singh, Deepika Padukone, Tahir Raj Bhasin, Jiiva"
166,tt15516726,Selfiee,2023,"Action, Comedy, Drama",,Raj Mehta,"Akshay Kumar, Mrunal Thakur, Nushrratt Bharuccha, Emraan Hashmi"
167,tt0420332,Veer-Zaara,2004,"Drama, Family, Musical",,Yash Chopra,"Shah Rukh Khan, Preity G Zinta, Rani Mukerji, Kirron Kher"
168,tt2215477,Goliyon Ki Rasleela Ram-Leela,2013,"Drama, Musical, Romance",,Sanjay Leela Bhansali,"Ranveer Singh, Deepika Padukone, Supriya Pathak, Sharad Kelkar"
169,tt5970844,Thugs of Hindostan,2018,"Action, Adventure",,Vijay Krishna Acharya,"Aamir Khan, Amitabh Bachchan, Lloyd Owen, Katrina Kaif"
170,tt15680228,Bheed,2023,"Drama, History",,Anubhav Sinha,"Rajkummar Rao, Pankaj Kapur, Bhumi Pednekar, Aditya Srivastav"
171,tt0449999,Kabhi Alvida Naa Kehna,2006,"Drama, Romance",,Karan Johar,"Shah Rukh Khan, Rani Mukerji, Amitabh Bachchan, Abhishek Bachchan"
172,tt11934846,Badhaai Do,2022,"Comedy, Crime, Drama",,Harshavardhan Kulkarni,"Rajkummar Rao, Bhumi Pednekar, Chum Darang, Sheeba Chaddha"
173,tt27124947,Prem Ki Shaadi,2024,"Drama, Romance",,Sooraj R. Barjatya,"Salman Khan, Keerthy Suresh, Kriti Kharbanda, Parineeti Chopra"
174,tt10230404,Ghost Stories,2020,"Horror, Thriller",,"Zoya Akhtar, Dibakar Banerjee, Karan Johar, Anurag Kashyap","Janhvi Kapoor, Surekha Sikri, Amruta Subhash, Vijay Varma"
175,tt16539454,Pushpa: The Rule - Part 2,2024,"Action, Crime, Drama",,Sukumar,"Allu Arjun, Sunil, Fahadh Faasil, Rashmika Mandanna"
176,tt12357758,Climax,2020,"Action, Horror, Thriller",,Ram Gopal Varma,"Mia Malkova, Mourmi, Renan Severo"
177,tt8108202,Stree,2018,"Comedy, Horror",,Amar Kaushik,"Ashish Chhipa, Rajkummar Rao, Shraddha Kapoor, Pankaj Tripathi"
178,tt0265343,Monsoon Wedding,2001,"Comedy, Drama, Romance",,Mira Nair,"Naseeruddin Shah, Lillete Dubey, Shefali Shah, Vijay Raaz"
179,tt1934231,Delhi Belly,2011,"Action, Comedy, Crime",,"Abhinay Deo, Akshat Verma","Imran Khan, Vir Das, Kunaal Roy Kapur, Shenaz Treasury"
180,tt21262240,Mission Raniganj,2023,"Biography, Drama, History",,Tinu Suresh Desai,"Akshay Kumar, Parineeti Chopra, Rajesh Sharma, Ravi Kishan"
181,tt0347473,Main Hoon Na,2004,"Action, Comedy, Drama",,Farah Khan,"Shah Rukh Khan, Sushmita Sen, Suniel Shetty, Zayed Khan"
182,tt0284137,Gadar: Ek Prem Katha,2001,"Action, Drama, Romance",,Anil Sharma,"Sunny Deol, Ameesha Patel, Amrish Puri, Lillete Dubey"
183,tt15360286,Bhagwan Bharose,2023,"Comedy, Drama",,Shiladitya Bora,"Satendra Soni, Sparsh Suman, Vinay Pathak, Masumeh Makhija"
184,tt0488414,Omkara,2006,"Action, Crime, Drama",,Vishal Bhardwaj,"Ajay Devgn, Kareena Kapoor, Saif Ali Khan, Konkona Sen Sharma"
185,tt0871510,Chak De! India,2007,"Drama, Family, Sport",,Shimit Amin,"Shah Rukh Khan, Vidya Malvade, Sagarika Ghatge, Shilpa Shukla"
186,tt0213890,Mohabbatein,2000,"Drama, Musical, Romance",,Aditya Chopra,"Amitabh Bachchan, Shah Rukh Khan, Uday Chopra, Jugal Hansraj"
187,tt1029231,Krrish 3,2013,"Action, Adventure, Sci-Fi",,Rakesh Roshan,"Hrithik Roshan, Vivek Oberoi, Priyanka Chopra Jonas, Kangana Ranaut"
188,tt8983202,Kabir Singh,2019,"Action, Drama, Romance",,Sandeep Reddy Vanga,"Shahid Kapoor, Kiara Advani, Nikita Dutta, Soham Majumdar"
189,tt12567088,Raat Akeli Hai,2020,"Crime, Drama, Mystery",,Honey Trehan,"Ashish Chhipa, Nawazuddin Siddiqui, Radhika Apte, Aditya Srivastav"
190,tt7721946,Housefull 4,2019,"Action, Comedy, Drama",,Farhad Samji,"Akshay Kumar, Riteish Deshmukh, Bobby Deol, Kriti Sanon"
191,tt2461132,Happy New Year,2014,"Action, Comedy, Crime",,Farah Khan,"Shah Rukh Khan, Deepika Padukone, Abhishek Bachchan, Boman Irani"
192,tt6692354,Ittefaq,2017,"Crime, Mystery, Thriller",,Abhay Chopra,"Sidharth Malhotra, Sonakshi Sinha, Akshaye Khanna, Mandira Bedi"
193,tt4832640,Sultan,2016,"Action, Drama, Romance",,Ali Abbas Zafar,"Salman Khan, Anushka Sharma, Randeep Hooda, Amit Sadh"
194,tt4110568,Dil Dhadakne Do,2015,"Comedy, Drama, Romance",,Zoya Akhtar,"Anil Kapoor, Shefali Shah, Priyanka Chopra Jonas, Ranveer Singh"
