,movie_id,movie_name,year,genre,,director,cast
1587,tt0098976,Aaj Ka Arjun,1990,"Action, Crime, Drama",,K.C. Bokadia,"Amitabh Bachchan, Jaya Prada, Radhika Sarathkumar, Suresh Oberoi"
1588,tt1343362,Do Knot Disturb,2009,"Comedy, Drama",,David Dhawan,"Govinda, Sushmita Sen, Riteish Deshmukh, Lara Dutta"
1589,tt8698956,Lupt,2018,"Horror, Thriller",,Prabhuraj,"Jaaved Jaaferi, Niki Walia, Vijay Raaz, Rishab Chadha"
1590,tt8992946,Cargo,2019,"Drama, Fantasy, Sci-Fi",,Arati Kadav,"Vikrant Massey, Shweta Tripathi, Nandu Madhav, Konkona Sen Sharma"
1591,tt0248428,Shiva,1989,"Action, Crime, Drama",,Ram Gopal Varma,"Nagarjuna Akkineni, Amala Akkineni, Raghuvaran, J.D. Chakravarthi"
1592,tt0976026,Cheeni Kum,2007,"Comedy, Drama, Romance",,R. Balki,"Amitabh Bachchan, Tabu, Paresh Rawal, Zohra Sehgal"
1593,tt2798620,Chhota Bheem and the Curse of Damyaan,2012,"Animation, Adventure, Fantasy",,Rajiv Chilaka,"Jigna Bhardwaj, Chutki, Kaustav Ghosh, Rajesh Kava"
1594,tt1185412,Veer,2010,"Action, Adventure, Drama",,Anil Sharma,"Salman Khan, Jackie Shroff, Mithun Chakraborty, Zareen Khan"
1595,tt0106655,Damini,1993,"Crime, Drama",,Rajkumar Santoshi,"Meenakshi Sheshadri, Rishi Kapoor, Sunny Deol, Amrish Puri"
1596,tt26744890,Khichdi 2,2023, ,,Aatish Kapadia,"Pratik Gandhi, Kirti Kulhari, Farah Khan, Anant Vidhaat"
1597,tt4333128,The Huntress,,"Action, Drama, Sci-Fi",,Aatish Kapadia,"Pratik Gandhi, Kirti Kulhari, Farah Khan, Anant Vidhaat"
1598,tt0193449,Rang,1993,"Drama, Romance",,Talat Jani,"Jeetendra, Amrita Singh, Kamal Sadanah, Ayesha Jhulka"
1599,tt3429798,Jungle Ki Hasina,1990,"Action, Adventure",,K.S. Gopalakrishnan,"Babloo, Narendran, Shankar Sugandhi, Disco Shanti"
1600,tt0430202,Sandwich,2006,"Comedy, Thriller",,Anees Bazmee,"Govinda, Raveena Tandon, Mahima Chaudhry, Mohnish Behl"
1601,tt0084199,Khud-Daar,1982,"Action, Drama",,Ravi Tandon,"Sanjeev Kumar, Amitabh Bachchan, Vinod Mehra, Tanuja Samarth"
1602,tt1039989,Sunday,2008,"Action, Comedy, Mystery",,Rohit Shetty,"Ajay Devgn, Ayesha Takia, Arshad Warsi, Irrfan Khan"
1603,tt1667076,F.A.L.T.U,2011,"Comedy, Drama",,Remo D'Souza,"Arshad Warsi, Riteish Deshmukh, Jackky Bhagnani, Puja Gupta"
1604,tt11565160,The Y,2023,"Horror, Mystery, Thriller",,Girideva Raaj,"Yuvan Hariharan, Leonilla, Apsara, Chethan A"
1605,tt27918452,Swayambhu,,"Adventure, Drama, Fantasy",,"Aadhitya Bahudhanam, Bharat Krishnamachari","Samyuktha Menon, Nikhil Siddharth"
1606,tt0118654,Aunty No. 1,1998,"Action, Comedy, Drama",,Kirti Kumar,"Govinda, Raveena Tandon, Harish, Rohit Kumar Sharma"
1607,tt0409527,Shabd,2005,"Drama, Thriller",,Leena Yadav,"Sanjay Dutt, Aishwarya Rai Bachchan, Zayed Khan, Aakash Pandey"
1608,tt0064241,Do Raaste,1969,"Drama, Romance",,Raj Khosla,"Rajesh Khanna, Mumtaz Askari, Balraj Sahni, Prem Chopra"
1609,tt0232079,Mela,2000,"Action, Adventure, Comedy",,Dharmesh Darshan,"Aamir Khan, Twinkle Khanna, Faisal Khan, Johny Lever"
1610,tt4020624,Lingaa,2014,"Action, Comedy, Drama",,K.S. Ravikumar,"Rajinikanth, Anushka Shetty, Sonakshi Sinha, Jagapathi Babu"
1611,tt0397742,Yeh Vaada Raha,1982,"Romance, Musical, Drama",,Kapil Kapoor,"Rishi Kapoor, Tina Ambani, Poonam Dhillon, Rakhee Gulzar"
1612,tt1263679,Firaaq,2008,"Drama, History, Thriller",,Nandita Das,"Inaamulhaq, Nassar, Shahana Goswami, Nawazuddin Siddiqui"
1613,tt0284083,Ek Rishtaa: The Bond of Love,2001,Drama,,Suneel Darshan,"Amitabh Bachchan, Rakhee Gulzar, Akshay Kumar, Karisma Kapoor"
1614,tt0449159,15 Park Avenue,2005,Drama,,Aparna Sen,"Shabana Azmi, Konkona Sen Sharma, Rahul Bose, Dhritiman Chatterjee"
1615,tt0237022,Balika Badhu,1976,"Comedy, Drama, Romance",,Tarun Majumdar,"Sachin Pilgaonkar, Rajni Sharma, Govardhan Asrani, A.K. Hangal"
1616,tt1027800,Angoor,2005,Drama,,Kanti Shah,"Sapna Sappu, Rajesh Sabharwal, Amit Pachori, Anil Nagrath"
1617,tt0267289,Baap Beti,1954,Drama,,Bimal Roy,"Sunalini Devi, Dolly, Tabassum Govil, Nasir Hussain"
1618,tt0106986,Gardish,1993,"Action, Crime, Drama",,Priyadarshan,"Jackie Shroff, Amrish Puri, Dimple Kapadia, Farida Jalal"
1619,tt3380264,Kill Dil,2014,"Action, Comedy, Drama",,Shaad Ali,"Ranveer Singh, Ali Zafar, Parineeti Chopra, Govinda"
1620,tt0149573,Aashiqui,1990,"Musical, Drama, Romance",,Mahesh Bhatt,"Rahul Roy, Anu Agarwal, Avtar Gill, Tom Alter"
1621,tt0100816,Tridev,1989,"Action, Crime, Drama",,Rajiv Rai,"Sunny Deol, Naseeruddin Shah, Jackie Shroff, Madhuri Dixit"
1622,tt7972000,Junko,2017,Crime,,Abhinav Thakur,"Neelam Deysarkar, Aayush Thakur, Aarav Mavi, Aashif Eqbal"
1623,tt0121989,Baazi,1995,"Action, Thriller, Crime",,Ashutosh Gowariker,"Aamir Khan, Mamta Kulkarni, Paresh Rawal, Avtar Gill"
1624,tt2912578,Ankur Arora Murder Case,2013,"Drama, Thriller",,Sohail Tatari,"Kay Kay Menon, Visshesh Tiwari, Tisca Chopra, Arjun Mathur"
1625,tt0071205,Benaam,1974,"Drama, Mystery, Thriller",,Narendra Bedi,"Amitabh Bachchan, Moushumi Chatterjee, Satyendra Kapoor, Madan Puri"
1626,tt0216067,Parichay,1972,"Drama, Family, Musical",,Gulzar,"Jeetendra, Jaya Bachchan, Pran Sikand, A.K. Hangal"
1627,tt0220594,Kartoos,1999,"Action, Thriller",,Mahesh Bhatt,"Sanjay Dutt, Jackie Shroff, Manisha Koirala, Gulshan Grover"
1628,tt0121395,Imtihaan,1994,"Action, Drama, Romance",,Harry Baweja,"Sunny Deol, Saif Ali Khan, Raveena Tandon, Govardhan Asrani"
1629,tt8472964,Chintu Ka Birthday,2020,"Comedy, Drama, War",,"Devanshu Singh, Satyanshu Singh","Vinay Pathak, Tillotama Shome, Seema Pahwa, Khaled Masso"
1630,tt8396186,Amavas,2019,"Horror, Thriller",,Bhushan Patel,"Ali Asgar, Ali Asgar, Vivan Bhatena, Sabina Chema"
1631,tt1667823,Bhindi Baazaar,2011,"Crime, Drama, Thriller",,Ankush Bhatt,"Kay Kay Menon, Prashant Narayanan, Pawan Malhotra, Adil Feroz Khan"
1632,tt0071145,Ankur,1974,Drama,,Shyam Benegal,"Shabana Azmi, Sadhu Meher, Anant Nag, Priya Tendulkar"
1633,tt0214841,Karz,1980,"Action, Musical, Romance",,Subhash Ghai,"Rishi Kapoor, Tina Ambani, Simi Garewal, Raj Kiran"
1634,tt0079584,Mr. Natwarlal,1979,"Action, Comedy, Romance",,Rakesh Kumar,"Amitabh Bachchan, Rekha, Ajit Khan, Kader Khan"
1635,tt6689882,Rangeela Raja,2019,Comedy,,Sikander Bharti,"Govinda, Mishika Chourasia, Karan Aanand, Anupama Agnihotri"
1636,tt0350195,Teri Meherbaniyan,1985,"Action, Crime, Drama",,Vijay Reddy,"Jackie Shroff, Poonam Dhillon, Raj Kiran, Swapna"
1637,tt0378069,Hum Se Badkar Kaun,1981,"Adventure, Drama",,Deepak Bahry,"Ranjeet Bedi, Birbal, Mithun Chakraborty, Mohan Choti"
1638,tt9343754,Eeb Allay Ooo!,2019,"Comedy, Drama",,Prateek Vats,"Shardul Bharadwaj, Mahender Nath, Nutan Sinha, Shashi Bhushan"
1639,tt0267548,Haseena Maan Jaayegi,1999,"Action, Comedy, Romance",,David Dhawan,"Sanjay Dutt, Govinda, Karisma Kapoor, Pooja Batra"
1640,tt1883121,404: Error Not Found,2011,"Drama, Mystery, Thriller",,Prawaal Raman,"Rajvvir Aroraa, Imaaduddin Shah, Nishikant Kamat, Ruchir Raj"
1641,tt13245502,DJ Tillu,2022,"Action, Comedy, Crime",,Vimal Krishna,"Neha Shetty, Sidhu Jonnalagadda, Pragathi, Brahmaji"
1642,tt7722258,Genius,2018,"Action, Thriller",,Anil Sharma,"Utkarsh Sharma, Ishita Chauhan, Mithun Chakraborty, Ayesha Jhulka"
1643,tt10731264,Suraj Pe Mangal Bhari,2020,Comedy,,Abhishek Sharma,"Manoj Bajpayee, Karishma Tanna, Fatima Sana Shaikh, Abhishek Banerjee"
1644,tt0085138,Adi Shankaracharya,1983,"Biography, Drama",,G.V. Iyer,"Sarvadaman Banerjee, M.V. Narayana Rao, Manjunath Bhatt, Leela Narayana Rao"
1645,tt7340684,The Final Exit,2017,Horror,,Dhwanil Mehta,"Kunaal Roy Kapur, Mukesh Hariawala, Elena Kazan, Reyhna Malhotra"
1646,tt21627952,Dec-24,2023,"Horror, Thriller",,Nagaraj 'MG' Gowda,"Appu Badiger, Rakesh Bhoumik, Jagadeesha H G Doddi, Ravi K R Pete"
1647,tt5219770,Dev Bhoomi,2016,Drama,,Goran Paskaljevic,"Victor Banerjee, Geetanjali Thapa, Uttara Baokar, Raj Zutshi"
1648,tt15731658,Bull,2023,"Action, Drama",,Sangeeth Sivan,"Shahid Kapoor, Parth Siddhpura"
1649,tt9179426,Satellite Shankar,2019,"Action, Drama",,Irfan Kamal,"Sooraj Pancholi, Anil Reji, Saurabh Agnihotri, Megha Akash"
1650,tt0157339,Baton Baton Mein,1979,"Comedy, Romance",,Basu Chatterjee,"Amol Palekar, Tina Ambani, Govardhan Asrani, David Abraham"
1651,tt15944190,Soorya,,"Crime, Drama, Thriller",,M. Padmakumar,"Sunny Deol, Ravi Kishan, Tanushree Chakraborty, Virti Vaghani"
1652,tt1034449,Kidnap,2008,"Action, Crime, Drama",,Sanjay Gadhvi,"Sanjay Dutt, Imran Khan, Minissha Lamba, Vidya Malvade"
1653,tt0338477,Talaash: The Hunt Begins...,2003,"Action, Crime, Drama",,Suneel Darshan,"Rakhee Gulzar, Akshay Kumar, Kareena Kapoor, Pooja Batra"
1654,tt1785333,Chittagong,2012,"Action, Drama, War",,Bedabrata Pain,"Manoj Bajpayee, Barry John, Delzad Hiwale, Vega Tamotia"
1655,tt7720922,Batti Gul Meter Chalu,2018,Drama,,Shree Narayan Singh,"Shahid Kapoor, Shraddha Kapoor, Divyendu Sharma, Yami Gautam"
1656,tt27447678,Genie,2023,"Action, Fantasy",,Bhuvanesh Arjunan,"Wamiqa Gabbi, Jayam Ravi, Krithi Shetty, Kalyani Priyadarshan"
1657,tt2571140,Boss,2013,"Action, Comedy, Crime",,Anthony D'Souza,"Akshay Kumar, Shiv Panditt, Mithun Chakraborty, Ronit Roy"
1658,tt3949638,Power,2014,"Action, Comedy, Crime",,K.S. Ravindra,"Ravi Teja, Hansika Motwani, Regina Cassandra, Brahmanandam"
1659,tt11804356,Tsunami,,"Drama, Thriller",,Madhu Sudhanan,Spencer Patwal
1660,tt0420304,Viruddh... Family Comes First,2005,"Drama, Family",,Mahesh Manjrekar,"Amitabh Bachchan, Sharmila Tagore, John Abraham, Sanjay Dutt"
1661,tt0444913,Tango Charlie,2005,"Action, Adventure, Drama",,Mani Shankar,"Ajay Devgn, Bobby Deol, Sanjay Dutt, Suniel Shetty"
1662,tt3611266,Bank Chor,2017,"Action, Comedy, Crime",,Bumpy,"Riteish Deshmukh, Vivek Oberoi, Rhea Chakraborty, Sahil Vaid"
1663,tt2341766,Nautanki Saala!,2013,"Comedy, Drama, Romance",,Rohan Sippy,"Ayushmann Khurrana, Kunaal Roy Kapur, Pooja Salvi, Gaelyn Mendonca"
1664,tt2186933,Luv Shuv Tey Chicken Khurana,2012,Comedy,,Sameer Sharma,"Kunal Kapoor, Huma Qureshi, Vinod Nagpal, Rajesh Sharma"
1665,tt0215911,Koshish,1972,Drama,,Gulzar,"Sanjeev Kumar, Jaya Bachchan, Govardhan Asrani, Seema Deo"
1666,tt1736647,Sakthi,2011,"Action, Adventure, Fantasy",,Meher Ramesh,"N.T. Rama Rao Jr., Ileana D'Cruz, Pooja Bedi, Sonu Sood"
1667,tt0368811,Jajantaram Mamantaram,2003,"Action, Adventure, Comedy",,Soumitra Ranade,"Jaaved Jaaferi, Gulshan Grover, Manav Kaul, Joy Fernandes"
1668,tt2094854,Inkaar,2013,"Drama, Romance, Thriller",,"Sudhir Mishra, Jay Dev Banerjee","Arjun Rampal, Chitrangda Singh, Vipin Sharma, Mithun Rodwittiya"
1669,tt0115042,Zamaana Deewana,1995,"Action, Comedy, Drama",,Ramesh Sippy,"Jeetendra, Shatrughan Sinha, Shah Rukh Khan, Raveena Tandon"
1670,tt0203289,American Desi,2001,"Comedy, Drama, Romance",,Piyush Dinker Pandya,"Deep Katdare, Ronobir Lahiri, Purva Bedi, Rizwan Manji"
1671,tt9817760,Jai Mummy Di,2020,"Comedy, Drama, Romance",,Navjot Gulati,"Poonam Dhillon, Supriya Pathak, Sunny Singh, Sonnalli Seygall"
1672,tt12631534,Rosie: The Saffron Chapter,2022,"Horror, Mystery, Thriller",,Vishal Mishra,"Arbaaz Khan, Tanishaa Mukerji, Shivin Narang, Vivek Oberoi"
1673,tt27510174,Stree 2,2024,"Comedy, Horror",,Amar Kaushik,"Shraddha Kapoor, Rajkummar Rao, Pankaj Tripathi, Varun Dhawan"
1674,tt0214178,Sooryavansham,1999,"Action, Drama",,"E.V.V. Satyanarayana, Pranavanand","Amitabh Bachchan, Soundarya, Jayasudha, Mukesh Rishi"
1675,tt8130558,One Day: Justice Delivered,2019,"Action, Crime, Thriller",,Ashok Nanda,"Anupam Kher, Kumud Mishra, Esha Gupta, Zakir Hussain"
1676,tt0248216,Na Tum Jaano Na Hum,2002,"Comedy, Drama, Musical",,Arjun Sablok,"Hrithik Roshan, Saif Ali Khan, Esha Deol, Alok Nath"
1677,tt4949324,Mohalla Assi,2015,"Comedy, Drama",,Chandra Prakash Dwivedi,"Sunny Deol, Sakshi Tanwar, Ravi Kishan, Saurabh Shukla"
1678,tt5207116,X: Past Is Present,2015,"Drama, Mystery, Romance",,"Hemant Gaba, Pratim D. Gupta, Sudhish Kamath, Nalan Kumarasamy, Anu Menon, Sandeep Mohan, Qaushiq Mukherjee, Rajshree Ojha, Raja Sen, Abhinav Shiv Tiwari, Suparn Varma","Rajat Kapoor, Radhika Apte, Bidita Bag, Piaa Bajpai"
1679,tt15260176,Despatch,2023,Drama,,Kanu Behl,"Manoj Bajpayee, Shahana Goswami, Nikhil Vijay, Ajay Purkar"
1680,tt1273218,Kuselan,2008,"Comedy, Drama, Family",,P. Vasu,"Rajinikanth, Pasupathy, Meena, Nayanthara"
1681,tt0431873,Lagaam,1976,Action,,Desh Gautam,"Vinod Khanna, Yogeeta Bali, Bindu Desai, Prem Chopra"
1682,tt0067840,Tere Mere Sapne,1971,"Drama, Romance",,Vijay Anand,"Dev Anand, Mumtaz Askari, Mahesh Kaul, Vijay Anand"
1683,tt0437407,Parineeta,2005,"Drama, Musical, Romance",,Pradeep Sarkar,"Vidya Balan, Saif Ali Khan, Sanjay Dutt, Dia Mirza"
1684,tt11069946,The Immortal Ashwatthama,,"Action, Adventure, Fantasy",,Aditya Dhar,"Allu Arjun, Vicky Kaushal, Sara Ali Khan"
1685,tt1188982,Jai Ho,2014,"Action, Drama",,Sohail Khan,"Salman Khan, Daisy Shah, Tabu, Danny Denzongpa"
1686,tt2140465,Tanu Weds Manu Returns,2015,"Comedy, Drama, Romance",,Aanand L. Rai,"Kangana Ranaut, Madhavan, Jimmy Shergill, Deepak Dobriyal"
1687,tt1694542,Tanu Weds Manu,2011,"Comedy, Drama, Romance",,Aanand L. Rai,"Madhavan, Kangana Ranaut, Jimmy Shergill, Deepak Dobriyal"
1688,tt14083776,Karma Strikes,2023,"Drama, Romance, Thriller",,Kartik Swaminathan Venkatraman,"Johnny Serret, Yuvradnyee, Michael Stephen Walls, Sagar Sharma"
1689,tt0104645,Kshatriya,1993,"Action, Drama, War",,J.P. Dutta,"Sunil Dutt, Dharmendra, Vinod Khanna, Rakhee Gulzar"
1690,tt0094958,Dayavan,1988,"Action, Crime, Drama",,Feroz Khan,"Vinod Khanna, Feroz Khan, Amala Akkineni, Amrish Puri"
1691,tt29169633,Tamso,2023,"Drama, Horror, Thriller",,Stephen Alexander,"Rashmi Somvanshi, Ritika Gupta, Vaishnavi Singh, Ansh Pandey"
1692,tt0286672,Haqeeqat,1995,"Action, Drama, Romance",,Kuku Kohli,"Ajay Devgn, Tabu, Aruna Irani, Mohan Joshi"
1693,tt0076167,Hum Kisise Kum Naheen,1977,"Action, Comedy, Drama",,Nasir Hussain,"Rishi Kapoor, Tariq, Kaajal Kiran, Amjad Khan"
1694,tt13556522,Apne 2,,Drama,,Anil Sharma,"Sunny Deol, Dharmendra, Bobby Deol, Rohit Choudhary"
1695,tt0476819,Nehlle Pe Dehlla,2007,"Action, Comedy, Crime",,Ajay Chandhok,"Sanjay Dutt, Bipasha Basu, Saif Ali Khan, Kim Sharma"
1696,tt0250122,Yeshwant,1997,"Action, Crime, Drama",,Anil Mattoo,"Nana Patekar, Madhoo, Atul Agnihotri, Mohan Joshi"
1697,tt12845296,The Hidden Strike,2020,War,,Suzad Iqbal Khan,"Deepraj Rana, Mir Sarwar, Jimmy Sharma, Lakhwinder"
1698,tt14103312,Woh Ladki Hai Kahaan,2023,"Comedy, Drama",,Arshad Syed,"Taapsee Pannu, Pratik Gandhi, Prateik Patil Babbar, Mahadev Singh Lakhawat"
1699,tt13751982,Amar Prem,2020,Drama,,Tanveer Hashmi,"Kundan Bhardwaj, Chandrima Banerjee, Kajal Chauhan, Ranjeet Jha"
1700,tt2199330,Thadaiyara Thaakka,2012,"Action, Crime, Drama",,Magizh Thirumeni,"Arun Vijay, Mamta Mohandas, Rakul Preet Singh, Vamsi Krishna"
1701,tt1169841,Return of Hanuman,2007,"Animation, Action, Adventure",,Anurag Kashyap,"Kathleen Barr, Lillian Carlson, Raj Singh Jhinjar, Irfan Khan"
1702,tt1239276,Rang Rasiya,2008,"Biography, Drama, Romance",,Ketan Mehta,"Randeep Hooda, Nandana Sen, Paresh Rawal, Ashish Vidyarthi"
1703,tt0476805,Malamaal Weekly,2006,"Comedy, Drama, Romance",,Priyadarshan,"Paresh Rawal, Om Puri, Riteish Deshmukh, Reema Sen"
1704,tt19284176,Ticket ek Sangharsh,2023,"Drama, Thriller",,Mahi Dubey,"Mahi Dubey, Nirmal Soni, Sanjay Dubey, Neha Sharma"
1705,tt27216785,Angithee 2,2023,Drama,,Shoib Nikash Shah,"Rishi Bhutani, Fezan Khan, Shafaq Naaz"
1706,tt28396066,Jaane Do,2023,Romance,,Jugal Raja,"Pragati Anand, Abhishek Panwar"
1707,tt7179784,Irumbu Thirai,2018,"Action, Crime, Thriller",,P.S. Mithran,"Vishal, Samantha Ruth Prabhu, Arjun Sarja, Delhi Ganesh"
1708,tt1887763,Haunted - 3D,2011,"Action, Fantasy, Horror",,Vikram Bhatt,"Mimoh Chakraborty, Tia Bajpai, Achint Kaur, Mohan Kapur"
1709,tt1191138,Thoda Pyaar Thoda Magic,2008,"Comedy, Drama, Family",,Kunal Kohli,"Saif Ali Khan, Rani Mukerji, Rishi Kapoor, Akshat Chopra"
1710,tt0331639,Shakthi: The Power,2002,"Action, Drama, Thriller",,Krishna Vamsi,"Karisma Kapoor, Nana Patekar, Sanjay Kapoor, Jai Gidwani"
1711,tt0072777,Chhoti Si Baat,1976,"Comedy, Romance",,Basu Chatterjee,"Ashok Kumar, Vidya Sinha, Amol Palekar, Govardhan Asrani"
1712,tt3142688,Finding Fanny,2014,"Adventure, Comedy, Drama",,Homi Adajania,"Deepika Padukone, Arjun Kapoor, Naseeruddin Shah, Dimple Kapadia"
1713,tt0107777,Parampara,1993,"Action, Drama, Romance",,Yash Chopra,"Sunil Dutt, Vinod Khanna, Aamir Khan, Ashwini Bhave"
1714,tt2354407,Teri Meri Kahaani,2012,"Comedy, Drama, Romance",,Kunal Kohli,"Shahid Kapoor, Priyanka Chopra Jonas, Prachi Desai, Neha Sharma"
1715,tt3531852,Bhoothnath Returns,2014,"Comedy, Drama, Fantasy",,Nitesh Tiwari,"Amitabh Bachchan, Boman Irani, Parth Bhalerao, Sanjay Mishra"
1716,tt7881524,Arjun Patiala,2019,"Action, Comedy",,Rohit Jugraj,"Diljit Dosanjh, Kriti Sanon, Varun Sharma, Abhimanue Kamboj"
1717,tt22769958,Udd Jaa Nanhe Dil,,Family,,Swaroop Raj Medara,"Gaurav Kamble, Suniel Shetty, Surendra Pal, Rajgopal Iyer"
1718,tt10852008,Balakot: the true story,2020,Action,,Omung Kumar,Vivek Oberoi
1719,tt0107986,Roop Ki Rani Choron Ka Raja,1993,"Action, Drama, Musical",,Satish Kaushik,"Anil Kapoor, Sridevi, Anupam Kher, Paresh Rawal"
1720,tt0061073,Teesri Manzil,1966,"Comedy, Musical, Mystery",,Vijay Anand,"Shammi Kapoor, Asha Parekh, Raj Mehra, Prem Chopra"
1721,tt0244776,Satyakam,1969,Drama,,Hrishikesh Mukherjee,"Ashok Kumar, Dharmendra, Sharmila Tagore, Rabi Ghosh"
1722,tt0363413,Agni Pankh,2004,"Action, Drama, Romance",,Sanjeev Puri,"Jimmy Shergill, Sameer Dharmadhikari, Rahul Dev, Shamita Shetty"
1723,tt6747420,Rajma Chawal,2018,"Comedy, Drama, Family",,Leena Yadav,"Amyra Dastur, Mukesh Chhabra, Rishi Kapoor, Sheeba Chaddha"
1724,tt0135161,Bhai,1997,"Action, Drama",,Deepak S. Shivdasani,"Suniel Shetty, Pooja Batra, Sonali Bendre, Shakti Kapoor"
1725,tt0172519,Guddu,1995,"Drama, Romance",,Prem Lalwani,"Deepti Naval, Mukesh Khanna, Manisha Koirala, Shah Rukh Khan"
1726,tt0187150,Himmatwala,1983,"Action, Comedy, Drama",,K. Raghavendra Rao,"Sridevi, Jeetendra, Amjad Khan, Waheeda Rehman"
1727,tt0476762,Big Brother,2007,"Action, Crime, Drama",,Guddu Dhanoa,"Sunny Deol, Priyanka Chopra Jonas, Vikas Anand, Ashok Kumar Beniwal"
1728,tt0060104,Amrapali,1966,"Musical, Fantasy",,Lekh Tandon,"Vyjayanthimala, Sunil Dutt, Premnath Malhotra, Bipin Gupta"
1729,tt0359440,Hukumat,1987,"Action, Drama",,Anil Sharma,"Dharmendra, Rati Agnihotri, Shammi Kapoor, Sadashiv Amrapurkar"
1730,tt0252318,Chhoti Chhoti Baatein,1965,Drama,,Motilal,"Motilal, Leela Mishra, Moti Sagar, Nadira"
1731,tt27411485,Minus 31: The Nagpur Files,2023,"Crime, Mystery",,Pratik Moitro,"Raghubir Yadav, Rucha Inamdar, Rajesh Sharma, Kaam Bhaari"
1732,tt0451833,No Entry,2005,"Comedy, Drama, Musical",,Anees Bazmee,"Salman Khan, Anil Kapoor, Fardeen Khan, Bipasha Basu"
1733,tt0348843,Jism,2003,"Drama, Romance, Thriller",,Amit Saxena,"Bipasha Basu, John Abraham, Gulshan Grover, Vinay Pathak"
1734,tt0242314,Billoo Baadshah,1989,"Action, Crime, Drama",,Sisir Misra,"Shatrughan Sinha, Anita Raj, Govinda, Neelam Kothari"
1735,tt0118660,Auzaar,1997,"Action, Drama, Musical",,Sohail Khan,"Salman Khan, Sanjay Kapoor, Shilpa Shetty Kundra, Nirmal Pandey"
1736,tt6494052,Nenu Local,2017,"Action, Comedy, Romance",,Trinadha Rao Nakkina,"Nani, Keerthy Suresh, Naveen Chandra, Sachin Khedekar"
1737,tt8107464,Amar Akbar Anthony,2018,"Action, Comedy, Crime",,Sreenu Vaitla,"Ravi Teja, Ileana D'Cruz, Vikramjeet Virk, Abhimanyu Singh"
1738,tt0405024,Hum Kaun Hai?,2004,"Horror, Drama, Mystery",,Ravi Sharma Shankar,"Amitabh Bachchan, Dimple Kapadia, Dharmendra, Moushumi Chatterjee"
1739,tt28229250,ANOLB,,Sci-Fi,,Shubham Mahadev,Ravish Rajora
1740,tt0168516,Biwi Ho To Aisi,1988,"Comedy, Drama",,J.K. Bihari,"Rekha, Farooq Shaikh, Bindu Desai, Govardhan Asrani"
1741,tt5313980,Tere Bin Laden: Dead or Alive,2016,Comedy,,"Abhishek Sharma, Deepak Chandra","Maniesh Paul, Pradhuman Singh, Sikandar Kher, Parthaa Akerkar"
1742,tt0242840,Sampoorna Ramayana,1961,"Drama, Adventure, Action",,Babubhai Mistry,"Mahipal, Anita Guha, Sulochana Latkar, Lalita Pawar"
1743,tt0118957,Deewana Mastana,1997,"Comedy, Romance",,David Dhawan,"Anil Kapoor, Govinda, Juhi Chawla, Johny Lever"
1744,tt24216816,Shadyantra,2022,Thriller,,Ganesh Yadav,"Hina Khan, Chandan Roy Sanyal, Kunaal Roy Kapur, Shruti Bapna"
1745,tt0176105,Roti,1974,"Drama, Romance, Thriller",,Manmohan Desai,"Rajesh Khanna, Mumtaz Askari, Nirupa Roy, Sujit Kumar"
1746,tt0070935,Yaadon Ki Baaraat,1973,"Action, Drama, Musical",,Nasir Hussain,"Dharmendra, Zeenat Aman, Vijay Arora, Imtiaz Khan"
1747,tt9735672,Eiga Doraemon: Nobita no getsumen tansaki,2019,"Animation, Action, Adventure",,"Jeong-beom Lee, Shinnosuke Yakuwa","Wasabi Mizuta, Megumi Ohara, Yumi Kakazu, Subaru Kimura"
1748,tt7613166,Dhh,2017,"Drama, Family",,Manish Saini,"Naseeruddin Shah, Kahaan, Karan Patel, Kuldeep Sodha"
1749,tt0073224,Kaala Sona,1975,"Action, Thriller",,Ravikant Nagaich,"Feroz Khan, Parveen Babi, Prem Chopra, Farida Jalal"
1750,tt0255112,Dhaai Akshar Prem Ke,2000,"Drama, Romance",,Raj Kanwar,"Abhishek Bachchan, Aishwarya Rai Bachchan, Amrish Puri, Anupam Kher"
1751,tt0497573,Sandai Kozhi,2005,Action,,N. Linguswamy,"Vishal, Meera Jasmine, Raj Kiran, Lal"
1752,tt26787644,Maama Mascheendra,2023,"Action, Drama",,Harsha Vardhan,"Eesha Rebba, Ajay, Sudheer Babu Posani, Mirnalini Ravi"
1753,tt7559180,99 Songs,2019,"Musical, Romance",,Vishwesh Krishnamoorthy,"Ehan Bhat, Edilsy Vargas, Tenzing Dalha, Lisa Ray"
1754,tt0444767,A Sublime Love Story: Barsaat,2005,"Drama, Romance",,Suneel Darshan,"Bobby Deol, Priyanka Chopra Jonas, Bipasha Basu, Mahesh Thakur"
1755,tt9390222,72 Hours: Martyr Who Never Died,2019,"Action, Biography, Drama",,Avinash Dhyani,"Avinash Dhyani, Prashil Rawat, Mukesh Tiwari, Yeshi Dema"
1756,tt0112876,Diya Aur Toofan,1995,"Action, Drama, Thriller",,K. Bapaiah,"Mithun Chakraborty, Madhoo, Maya Alagh, Vijay Arora"
1757,tt17507072,Silsila Sidnaaz Ka,2021,Romance,,K. Bapaiah,"Mithun Chakraborty, Madhoo, Maya Alagh, Vijay Arora"
1758,tt2882200,Sheela Meri Jaan,1990,Thriller,,K. Bapaiah,"Mithun Chakraborty, Madhoo, Maya Alagh, Vijay Arora"
1759,tt2215163,Issaq,2013,"Drama, Romance",,Manish Tiwary,"Prateik Patil Babbar, Amyra Dastur, Ravi Kishan, Prashant Narayanan"
1760,tt1105709,8 x 10 Tasveer,2009,"Action, Crime, Drama",,Nagesh Kukunoor,"Akshay Kumar, Ayesha Takia, Jaaved Jaaferi, Girish Karnad"
1761,tt0259854,Andhera,1975,"Crime, Drama, Thriller",,"Shyam Ramsay, Tulsi Ramsay","Sameer Khan, Vani Ganpati, Imtiaz Khan, Dulari"
1762,tt0306855,Style,2001,"Comedy, Musical, Mystery",,N. Chandra,"Sharman Joshi, Sahil Khan, Riya Sen, Shilpi Sharma"
1763,tt2716060,Jawani Ki Kahani,1986,Drama,,K.R. Rangan,"Abhilasha, Vijay Arora, Ramesh Deo, Seema Deo"
1764,tt28134270,Monster,XXX,Thriller,,Keshhav Panneriy,"Amarjeet Singh, Hannah Panneriy"
1765,tt0295682,The Warrior,2001,"Adventure, Drama",,Asif Kapadia,"Irrfan Khan, Puru Chibber, Aino Annuddin, Manoj Mishra"
1766,tt1020978,Naqaab,2007,"Crime, Drama, Romance",,"Abbas Alibhai Burmawalla, Mastan Alibhai Burmawalla","Bobby Deol, Akshaye Khanna, Urvashi Sharma, Vikas Kalantri"
1767,tt5742874,Sarkar 3,2017,"Action, Crime, Drama",,Ram Gopal Varma,"Amitabh Bachchan, Yami Gautam, Manoj Bajpayee, Abhishek Bachchan"
1768,tt0322653,Mere Yaar Ki Shaadi Hai,2002,"Comedy, Drama, Romance",,Sanjay Gadhvi,"Uday Chopra, Jimmy Shergill, Bipasha Basu, Tanaaz Currim Irani"
1769,tt28549549,Pyaar Hai Toh Hai,2023, ,,"Pradeep R.K. Chaudhary, Pradeep R.K. Chaudhary","Karan Hariharan, Paanie Kashyap, Rohit Choudhury, Shiv Prateek"
1770,tt8060624,Nawabzaade,2018,"Comedy, Romance",,Jayesh Pradhan,"Dharmesh Yelande, Punit Pathak, Raghav Juyal, Isha Rikhi"
1771,tt4807830,Lipstick Under My Burkha,2016,"Comedy, Drama",,Alankrita Shrivastava,"Aahana Kumra, Ratna Pathak Shah, Konkona Sen Sharma, Plabita Borthakur"
1772,tt2246724,Ghanchakkar,2013,"Comedy, Crime, Thriller",,Raj Kumar Gupta,"Emraan Hashmi, Vidya Balan, Namit Das, Rajesh Sharma"
1773,tt0442855,Vaada,2005,"Crime, Drama, Mystery",,Satish Kaushik,"Arjun Rampal, Zayed Khan, Ameesha Patel, Alok Nath"
1774,tt11203296,Khiladi 1080,2025,Action,,Kabir Sadanand,"Rakul Preet Singh, Sonakshi Sinha, Huma Qureshi, Shehnaaz Gill"
1775,tt0084324,Meri Jung,1985,"Action, Drama",,Subhash Ghai,"Anil Kapoor, Girish Karnad, Nutan, Amrish Puri"
1776,tt0392360,Love,1991,"Drama, Musical, Romance",,Suresh Krishna,"Salman Khan, Arun Bakshi, Rita Bhaduri, Sunil Dhawan"
1777,tt0437182,Family: Ties of Blood,2006,"Action, Crime, Drama",,Rajkumar Santoshi,"Amitabh Bachchan, Akshay Kumar, Bhoomika Chawla, Aryeman Ramsay"
1778,tt0486615,London Dreams,2009,"Drama, Music",,Vipul Amrutlal Shah,"Salman Khan, Ajay Devgn, Om Puri, Aditya Roy Kapoor"
1779,tt0488976,C U at 9,2005,"Drama, Horror, Mystery",,Marion Rodrigues,"Isaiah, Malavika Nair, Kanksha, Marion Rodrigues"
1780,tt0103763,Balwaan,1992,"Action, Adventure",,Deepak Anand,"Suniel Shetty, Divya Bharti, Danny Denzongpa, Avtar Gill"
1781,tt12403994,Aashiqui 3,,"Drama, Music, Romance",,Anurag Basu,Kartik Aaryan
1782,tt0395802,Veergati,1995,"Action, Drama",,K.K. Singh,"Salman Khan, Atul Agnihotri, Sudesh Berry, Pooja Dadwal"
1783,tt12788586,Perversion,2020,Drama,,Sandeep Patra,"Adiya, Natasha, Sneha, Tanisha"
1784,tt0459605,Eklavya,2007,"Action, Drama, Mystery",,Vidhu Vinod Chopra,"Amitabh Bachchan, Saif Ali Khan, Sanjay Dutt, Vidya Balan"
1785,tt0071730,Kunwara Baap,1974,"Comedy, Drama",,Mehmood,"Mehmood, Bharathi, Aachi Manorama, Bhushan Tiwari"
1786,tt2726810,Junglee Tarzan,2001,Action,,Kishan Shah,"Vijay Saxena, Nisha Kamat, Joginder Shelly, Jr. Shah Rukh Khan"
1787,tt0082796,Naram Garam,1981,"Comedy, Drama",,Hrishikesh Mukherjee,"Amol Palekar, Swaroop Sampat, Utpal Dutt, A.K. Hangal"
1788,tt8175968,High Jack,2018,Comedy,,Akarsh Khurana,"Sumeet Vyas, Mantra Mugdh, Sonnalli Seygall, Boloram Das"
1789,tt0099080,Baaghi: A Rebel for Love,1990,"Action, Drama, Romance",,Deepak S. Shivdasani,"Salman Khan, Nagma, Shakti Kapoor, Kiran Kumar"
1790,tt3398048,Tevar,2015,"Action, Drama, Romance",,Amit Ravindernath Sharma,"Arjun Kapoor, Sonakshi Sinha, Manoj Bajpayee, Deepti Naval"
